79000,publish_featured_content_for_all_hub_79000,Publish featured content for all hub,Library,Super Admin,Gives users access to publish featured content for all hub,Featured Programs,,,,,,,Y
79001,publish_featured_content_for_specific_orgs_79001,Publish featured content for specific orgs,Library,Super Admin,Gives users access to publish featured content for specific organizations,Featured Programs,,,,,,,Y
79002,publish_featured_content_for_all_orgs_79002,Publish featured content for all orgs,Library,Super Admin,Gives users access to publish featured content for all organizations,Featured Programs,,,,,,,Y
80000,free_programs_80000,Free Programs,Library,Teacher,Gives users access to Free Programs Page (i.e. via icons/buttons),Free Programs,,,,,,,
80001,view_free_programs_80001,View Free Programs,Library,Teacher,Gives users access to view free programs,Free Programs,,,,,,,
81000,view_bada_rhyme_81000,View Bada Rhyme,Library,Teacher,Gives users access to view Bada Rhyme,Free Programs,,,,,,,
81001,view_bada_genius_81001,View Bada Genius,Library,Teacher,Gives users access to view Bada Genius,Free Programs,,,,,,,
81002,view_bada_talk_81002,View Bada Talk,Library,Teacher,Gives users access to view Bada Talk,Free Programs,,,,,,,
81003,view_bada_sound_81003,View Bada Sound,Library,Teacher,Gives users access to view Bada Sound,Free Programs,,,,,,,
81004,view_bada_read_81004,View Bada Read,Library,Teacher,Gives users access to view Bada Read,Free Programs,,,,,,,
81005,view_bada_math_81005,View Bada Math,Library,Teacher,Gives users access to view Bada Math,Free Programs,,,,,,,
81006,view_bada_stem_81006,View Bada STEM,Library,Teacher,Gives users access to view Bada STEM,Free Programs,,,,,,,
81007,view_badanamu_esl_81007,View Badanamu ESL,Library,Teacher,Gives users access to view Badanamu ESL,Free Programs,,,,,,,
81008,use_free_as_recommended_content_for_study_81008,Use Free as Recommended Content for Study,Library,Teacher,Gives users access to use free as recommended content for study,Free Programs,,,,,,,
81009,undefinend_81009,undefinend,,,undefined,Free Programs,,,,,,,
85000,create_bada_rhyme_85000,Create Bada Rhyme,Library,Super Admin,Gives users access to create Bada Rhyme,Free Programs,,,,,,,
85001,create_bada_genius_85001,Create Bada Genius,Library,Super Admin,Gives users access to create Bada Genius,Free Programs,,,,,,,
85002,create_bada_talk_85002,Create Bada Talk,Library,Super Admin,Gives users access to create Bada Talk,Free Programs,,,,,,,
85003,create_bada_sound_85003,Create Bada Sound,Library,Super Admin,Gives users access to create Bada Sound,Free Programs,,,,,,,
85004,create_bada_read_85004,Create Bada Read,Library,Super Admin,Gives users access to create Bada Read,Free Programs,,,,,,,
85005,create_bada_math_85005,Create Bada Math,Library,Super Admin,Gives users access to create Bada Math,Free Programs,,,,,,,
85006,create_bada_stem_85006,Create Bada STEM,Library,Super Admin,Gives users access to create Bada STEM,Free Programs,,,,,,,
85007,undefined_85007,undefined,,,undefined,Free Programs,,,,,,,
85008,undefined_85008,undefined,,,undefined,Free Programs,,,,,,,
85009,undefined_85009,undefined,,,undefined,Free Programs,,,,,,,
88000,edit_bada_rhyme_88000,Edit Bada Rhyme,Library,Super Admin,Gives users access to edit Bada Rhyme,Free Programs,,,,,,,
88001,edit_bada_genius_88001,Edit Bada Genius,Library,Super Admin,Gives users access to edit Bada Genius,Free Programs,,,,,,,
88002,edit_bada_talk_88002,Edit Bada Talk,Library,Super Admin,Gives users access to edit Bada Talk,Free Programs,,,,,,,
88003,edit_bada_sound_88003,Edit Bada Sound,Library,Super Admin,Gives users access to edit Bada Sound,Free Programs,,,,,,,
88004,edit_bada_read_88004,Edit Bada Read,Library,Super Admin,Gives users access to edit Bada Read,Free Programs,,,,,,,
88005,edit_bada_math_88005,Edit Bada Math,Library,Super Admin,Gives users access to edit Bada Math,Free Programs,,,,,,,
88006,edit_bada_stem_88006,Edit Bada STEM,Library,Super Admin,Gives users access to edit Bada STEM,Free Programs,,,,,,,
88007,edit_badanamu_esl_88007,Edit Badanamu ESL,Library,Super Admin,Gives users access to edit Badanamu ESL,Free Programs,,,,,,,
88008,copy_free_content_into_library_88008,Copy Free Content into Library,Library,Org Admin,Gives user access to Copy Free Content feature,Free Programs,,,,,,,
88009,download_free_content__88009,Download Free Content,Library,Org Admin,Gives user access to Download Free Content feture,Free Programs,,,,,,,
89000,publish_free_content_for_all_hub_89000,Publish free content for all hub,Library,Super Admin,Gives users access to publish free content for all hub,Free Programs,,,,,,,
89001,publish_free_content_for_specific_orgs_89001,Publish free content for specific orgs,Library,Super Admin,Gives users access to publish free content for specific organizations,Free Programs,,,,,,,
89002,publish_free_content_for_all_orgs_89002,Publish free content for all orgs,Library,Super Admin,Gives users access to publish frree content for all organizations,Free Programs,,,,,,,