20227,create_subjects_20227,Create Subjects,Academic Profile,School Admin,Gives users access to create subjects,Subjects,,,,,,,Y
20228,create_school_classes_20228,Create School Classes,Academic Profile,School Admin,Gives users access to create classes within the associated School,Classes,,,,,,,
20330,edit_school_20330,Edit School,Academic Profile,School Admin,Gives users access to edit school,Schools,,,,,,,Y
20331,edit_program_20331,Edit Program,Academic Profile,School Admin,Gives users access to edit programs,Programs,,,,,,,Y
20332,edit_age_range_20332,Edit Age Range,Academic Profile,School Admin,Gives users access to edit age range,Age Range,,,,,,,Y
20333,edit_grade_20333,Edit Grade,Academic Profile,School Admin,Gives users access to edit grades,Grades,,,,,,,Y
20334,edit_class_20334,Edit Class,Academic Profile,Org Admin,Gives users access to edit classes within the Organization,Classes,,,,,,,Y
20335,move_students_to_another_class_20335,Move Students to Another Class,Academic Profile,School Admin,Gives users access to move students to another class,Classes,,,,,,,
20336,edit_teacher_in_class_20336,Edit Teacher in Class,Academic Profile,School Admin,Gives users access to edit teacher in class,Classes,,,,,,,
20337,edit_subjects_20337,Edit Subjects,Academic Profile,School Admin,Gives users access to edit subjects,Subjects,,,,,,,Y
20338,edit_students_in_class_20338,Edit Students in Class,Academic Profile,School Admin,Gives users access to edit students in class,Classes,,,,,,,
20339,edit_school_class_20339,Edit School Classes,Academic Profile,School Admin,Gives users access to edit classes within the associated School,Classes,,,,,,,
20440,delete_school_20440,Delete School,Academic Profile,School Admin,Gives users access to delete schools,Schools,,,,,,,Y
20441,delete_program_20441,Delete Program,Academic Profile,School Admin,Gives users access to delete programs,Programs,,,,,,,Y
20442,delete_age_range_20442,Delete Age Range,Academic Profile,School Admin,Gives users access to delete age ranges,Age Range,,,,,,,Y
20443,delete_grade_20443,Delete Grade,Academic Profile,School Admin,Gives users access to delete grades,Grades,,,,,,,Y
20444,delete_class_20444,Delete Class,Academic Profile,Org Admin,Gives users access to delete classes within the Organization,Classes,,,,,,,Y
20445,delete_student_from_class_roster_20445,Delete Student from Class Roster,Academic Profile,School Admin,Gives users access to delete students from class rosters,Classes,,,,,,,Y
20446,delete_teacher_from_class_20446,Delete Teacher from Class,Academic Profile,School Admin,Gives users access to delete teachers from class,Classes,,,,,,,Y
20447,delete_subjects_20447,Delete Subjects,Academic Profile,School Admin,Gives users access to delete subjects,Subjects,,,,,,,Y
20448,delete_school_class_20448,Delete School Classes,Academic Profile,School Admin,Gives users access to delete classes within the associated School,Classes,,,,,,,
20880,upload_schools_20880,Upload Schools,Academic Profile,Org Admin,Gives users access to upload schools,Schools,,,,,,,
20881,download_schools_20881,Download Schools,Academic Profile,Org Admin,Gives users access to download schools,Schools,,,,,,,
20882,upload_program_20882,Upload Program,Academic Profile,Org Admin,Gives users access to upload programs,Programs,,,,,,,
20883,download_program_20883,Download Program,Academic Profile,Org Admin,Gives users access to download programs,Programs,,,,,,,
20884,upload_class_roster_with_teachers_20884,Upload Class Roster with Teachers,Academic Profile,Org Admin,Gives users access to upload class rosters with teachers,Classes,,,,,,,
20885,download_class_roster_with_teachers_20885,Download Class Roster with Teachers,Academic Profile,Org Admin,Gives users access to download class rosters with teachers,Classes,,,,,,,
20886,upload_age_range_20886,Upload Age Range,Academic Profile,Org Admin,Gives users access to upload age ranges,Age Range,,,,,,,
20887,download_age_range_20887,Download Age Range,Academic Profile,Org Admin,Gives users access to download age ranges,Age Range,,,,,,,
20888,upload_grades_20888,Upload Grades,Academic Profile,Org Admin,Gives users access to upload grades,Grades,,,,,,,
20889,download_grades_20889,Download Grades,Academic Profile,Org Admin,Gives users access to download grades,Grades,,,,,,,
20890,upload_classes_20890,Upload Classes,Academic Profile,Org Admin,Gives users access to upload classes,Classes,,,,,,,
20891,download_classes_20891,Download Classes,Academic Profile,Org Admin,Gives users access to download classes,Classes,,,,,,,
20892,upload_subject_20892,Upload Subjects,Academic Profile,Org Admin,Gives users access to upload subjects,Subjects,,,,,,,
20893,download_subject_20893,Download Subjects,Academic Profile,Org Admin,Gives users access to download subjects,Subjects,,,,,,,
30100,roles_30100,Roles,Accounts,Org Admin,Gives users access to Roles Page (i.e. via icons/buttons),Roles,,,,,,,
30101,role_levels_30101,Role Levels,Accounts,Org Admin,Gives users access to view role levels,Roles,deprecate,,,,,,
30102,roles_and_permissions_30102,Roles and Permission Page,Accounts,Org Admin,Gives users access to view roles and permissions page,Roles,,,,,,,
30110,view_roles_and_permissions_30110,View Roles,Accounts,Org Admin,Gives users access to view roles and permissions,Roles,,,,,,,Y
30111,view_role_priority_levels_30111,View Role Priority Levels,Accounts,Org Admin,Gives users access to view role priority levels,Roles,deprecate,,,,,,
30112,view_role_permissions_30112,View Role Permissions,Accounts,Org Admin,Gives users access to view role permissions,Roles,deprecate,,,,,,Y
30220,create_groups_30220,Create Groups,Accounts,Org Admin,Gives users access to create groups,Roles,deprecate,,,,,,
30221,create_role_priority_levels_30221,Create Role Priority Levels,Accounts,Org Admin,Gives users access to create role priority levels,Roles,deprecate,,,,,,
30222,create_role_with_permissions_30222,Create Role with Permissions,Accounts,Org Admin,Gives users access to create roles with permissions,Roles,,,,,,,Y
30330,edit_groups_30330,Edit Groups,Accounts,Org Admin,Gives users access to edit groups,Roles,deprecate,,,,,,
30331,edit_role_priority_levels_30331,Edit Role Priority Levels,Accounts,Org Admin,Gives users access to edit role priority levels,Roles,deprecate,,,,,,
30332,edit_role_and_permissions_30332,Edit Role Permissions,Accounts,Org Admin,Gives users access to edit role permissions,Roles,,,,,,,Y
30440,delete_role_30440,Delete Role ,Accounts,Org Admin,Gives users access to delete roles,Roles,,,,,,,Y
40100,users_40100,Users,Accounts,Org Admin,Gives users access to Users Page (i.e. via icons/buttons),Users,"As a user with this permission, I can view view the button or interface to view the User Table.  ",User,,,,,
40101,view_user_page_40101,View User Page,Accounts,Org Admin,Gives users access to view user pages,Users,"As a user with this permission, I can view view and click the button to the User table, or access the link successfully to view the User table.  If I don't have this permission (a) ideally, the button is visible, however, unclickable, or (c) worst case scenario, the button is clickable, however, the user table is hidden and the user cannot see any users.",User,,40100,,,Y
40110,view_users_40110,View All Users,Accounts,Org Admin,Gives users access to view users,Users,"As a user with this permission, I can click the button to the User table and view the user details/information, or access the link successfully to view the User table and the appropriate filters defined by my visibility-range to view ALL USERS within the organization and organization's schools within the User Table.  If I don't have this permission I cannot view all users within the organization and organization's schools within the User Table.",User,"User A should see (a) users that are associated with all schools, and (b) users who are not associated with any school.  

Note: 
- CURRENTLY: To view ""all users"" this user has to be associated with ALL SCHOOLS created within the organization. 
- TO BE: A user with this permission should be able to view all users within the organization without having to be associated to all the schools.",40100,,,Y
40111,view_my_school_users_40111,View My School Users,Accounts,School Admin,Give users access to view users in specific schools,Users,"As a user with this permission, I can click the button to the User table and view the user details/information, or access the link successfully to view the User table and the appropriate filters defined by my visibility-range (partly defined by my associated schools) to view SPECIFIC users within the User Table.  If I don't have this permission (a) I cannot view the users within my associated schools, or (b) the users who are not associated with any school and are taking classes that belong to my school.",User,"User A should see (a) users that are associated with User A's schools, only.",40100,,,
40112,view_my_class_users_40112,View My Class Users,Accounts,Teacher,Gives users access to view users in taught classes,Users,"As a user with this permission, I can click the button to the User table and view the user details/information, or access the link successfully to view the User table and the appropriate filters defined by my visibility-range (partly defined by my associated schools' classes) to view SPECIFIC users who are in the classes I currently teach within the User Table.  If I don't have this permission (a) I cannot view the users within my associated schools' classes within the User Table.",User,"User A should see (a) users that are associated with User A's associated schools' classes, only",40100,,,
40113,view_my_users_40113,View My Users,Accounts,Parent,Gives users access to view users under their account,Users,"As a user with this permission, I can click the button to the User table and view the user details/information, or access the link successfully to view information within the User table of users who are associated to my email or phone account (it's plausible that to view this information is not necessarily within the User Table).  If I don't have this permission (a) I cannot view the details of users who are associated with my account.",User,,40100,,,
40220,create_users_40220,Create Users,Accounts,Org Admin,Gives users access to create users for the organization,Users,"As a user with this permission, I can click ""Create"" user to create: (a) a user within any school(s), and/or (b) a user that's not a part of any school.  Essentially, I can create any user required within the organization.  If I don't have this permission I cannot create all types of users within the organization and the organization school(s).
Note: A user with this permission will be able to ""reactivate"" a user that has been ""deactivated"" for less than 30 days, and has not bee deleted.",User,"User A should be able to create (a) users that are associated with any school within the organization, and (b) users who are not associated with any school.  
Note: It shouldn't be necessary for this user to be associated with SCHOOL A to create a user for SCHOOL A if they have this permission.  If this is the case currently, we should update accordingly. ",40100,,,Y
40221,create_my_school_users_40221,Create My School Users,Accounts,School Admin,Gives users access to create users for specific schools,Users,"As a user with this permission, I can click ""Create"" user to create a user within my visibility-range: (a) specifically, a user within my associated school(s).   If I don't have this permission I cannot create users within my school",User,"User A should be able to create (a) users that are associated with User A's schools, only.  
Note: If this user is associated with ALL SCHOOLS created within the organization, the only user they won't be able to create is a user without being associated to a school.",40100,,,
40222,create_my_class_users_40222,Create My Class Users,Accounts,Teacher,Gives users access to create users in taught classes,Users,deprecate,,,40100,,,
40223,create_my_users_40223,Create My Users,Accounts,Parent,Gives users access to create users under their account,Users,"As a user with this permission, I can use the app to create a user to be invited into an organization that will be associated to my email or phone account. If I don't have this permission (a) I cannot create a user that will be associated with my email or phone account.",User,,40100,,,
40330,edit_users_40330,Edit Users,Accounts,Org Admin,Gives users access to edit users,Users,"As a user with this permission, I can click ""Edit"" user to edit: (a) a user within any school(s), and/or (b) a user that's not a part of any school.  Essentially, I can edit any user required within the organization.  If I don't have this permission I cannot edit all types of users within the organization and the organization schools.",User,"User A should be able to edit (a) users that are associated with any school within the organization, and (b) users who are not associated with any school.  
Note: It shouldn't be necessary for this user to be associated with SCHOOL A to edit a user for SCHOOL A if they have this permission.  If this is the case currently, we should update accordingly. ","40100, and 40220",,,Y
40331,edit_my_school_users_40331,Edit My School Users,Accounts,School Admin,Gives users access to edit users in specific schools,Users,"As a user with this permission, I can click ""Edit"" user to edit a user within my visibility-range: (a) specifically, a user within my associated school(s).  If I don't have this permission I cannot edit users within my school(s).",User,"User A should be able to edit (a) users that are associated with User A's schools, only.  
Note: If this user is associated with ALL SCHOOLS created within the organization, the only user they won't be able to edit is a user without being associated to a school.","40100, and 40221",,,
40332,edit_my_class_users_40332,Edit My Class Users,Accounts,Teacher,Gives users access to edit users in taught classes,Users,deprecate,,,,,,
40333,edit_my_users_40333,Edit My Users,Accounts,Parent,Gives users access to edit users under their account,Users,"As a user with this permission, I can use the app to edit a user that is associated to my email or phone account. If I don't have this permission (a) I cannot edit a user that is associated with my email or phone account.",User,,"40100, and 40223",,,
40440,delete_users_40440,Delete Users,Accounts,Org Admin,Gives users access to delete users,Users,"As a user with this permission, I can click ""Delete"" user to delete: (a) a user within any school(s), and/or (b) a user that's not a part of any school.  Essentially, I can delete any user required within the organization.  If I don't have this permission I cannot delete all types of users within the organization and the organization schools.
Note: Deleting a user is one of the ways the system complys with GDPR and COPPA.  A user that has been deleted cannot be reactivated by the Org Admin.  In this case, to rejoin the organization, this user would need to be readded to the organization as a new user.  After a user is deleted from an organization, it is possible for a user to rejoin the organization. 
Note: Deleting a user prevents the user from many operations.  The user cannot sign into the organization, the user cannot create content, the user cannot be added to a class roster, the user cannot be scheduled for any scheduled event, and the user cannot attend a Live class (via a link) within that organization.",User,"User A should be able to delete (a) users that are associated with any school within the organization, and (b) users who are not associated with any school.  
Note: It shouldn't be necessary for this user to be associated with SCHOOL A to delete a user for SCHOOL A if they have this permission.  If this is the case currently, we should update accordingly. ","40100, and 40220",,,Y
40441,delete_my_school_users_40441,Delete My School Users,Accounts,School Admin,Gives users access to delete users in specific schools,Users,"As a user with this permission, I can click ""Delete"" user to delete a user within my visibility-range: (a) specifically, a user within my associated school(s).  If I don't have this permission I cannot delete users within my school(s).",User,"User A should be able to delete (a) users that are associated with User A's schools, only.  
Note: If this user is associated with ALL SCHOOLS created within the organization, the only user they won't be able to delete is a user without being associated to a school.","40100, and 40221",,,
40442,delete_my_class_users_40442,Delete My Class Users,Accounts,Teacher,Gives users access to delete users in taught classes,Users,deprecate,,,,,,
40443,delete_my_users_40443,Delete My Users,Accounts,Parent,Gives users access to delete users under their account,Users,"As a user with this permission, I can use the app to delete a user that is associated to my email or phone account. If I don't have this permission (a) I cannot delete a user that is associated with my email or phone account.  If I delete my user, I am making a request to delete the user within the indicated organization.  The user is deleted (or deactivated) within the organization automatically, or manually.",User,,"40100, and 40223",,,
40880,upload_users_40880,Upload Users,Accounts,Org Admin,Gives users access to upload users,Users,"As a user with this permission, I can use a .csv file to create (a) users within any school(s), and/or (b) a user that's not a part of any school.  Essentially, I can create any user required within the organization using a .csv file.  If I don't have this permission I cannot create all types of users within the organization and the organization school(s) using a .csv.",User,"User A should be able to create (a) users that are associated with any school within the organization, and (b) users who are not associated with any school using a .csv file.  
Note: It shouldn't be necessary for this user to be associated with SCHOOL A to create a user for SCHOOL A if they have this permission.  If this is the case currently, we should update accordingly. ",40100 and 40220 | 40221,,,Y
40881,download_users_40881,Download Users,Accounts,Org Admin,Gives users access to download users,Users,"As a user with this permission, I can download a .csv file of (a) users within any school(s), and/or (b) users that's not a part of any school.  Essentially, I can download all users within the organization into a .csv file.  If I don't have this permission I cannot download all types of users within the organization and the organization school(s) into a .csv.",User,"User A should be able to download (a) users that are associated with any school within the organization, and (b) users who are not associated with any school into a .csv file.  
Note: It shouldn't be necessary for this user to be associated with SCHOOL A to create a user for SCHOOL A if they have this permission.  If this is the case currently, we should update accordingly. ",40100 and 40220 | 40221,,,
40882,send_invitation_40882,Send Invitation,Accounts,Org Admin,Gives users access to send invitations,Users,"As a user with this permission, I can see a button/trigger to click that will manually send an invitation to users to join my organization. 
Note: When a user is added to an organization, an invitation to join my organization is automatically sent to this user ",,,40100 and 40220 | 40221,,,Y
40883,deactivate_user_40883,Deactivate User,Accounts,Org Admin,Gives users access to deactivate users,Users,"As a user with this permission, I can click ""Delete"" user to first ""Deactive"": (a) a user within any school(s), and/or (b) a user that's not a part of any school.  Essentially, I can ""deactivate"" then delete any user required within the organization.  If I don't have this permission I cannot delete all types of users within the organization and the organization schools.
Note: Deactivating a user keeps a user within the system giving a user with 'create_users_40220' permission 30 days to reactivate the user.  A user who has been deactivated for more than 30 days, cannot be reactivated, and is automatically deleted from the organization.
Note: Deactivating a user prevents the user from many operations.  The user cannot sign into the organization, the user cannot create content, the user cannot be added to a class roster, the user cannot be scheduled for any scheduled event, and the user cannot attend a Live class (via a link) within that organization.
Note: Deactivating a user is the first step to ""Deleting"" a user.",,,40100 and 40220 | 40221,,,
50100,billing_50100,Billing,Accounts,Org Admin,Gives users access to Billing Page (i.e. via icons/buttons),Billing,,,,,,,
50101,view_payment_details_and_make_payment_50101,View Payment Details and Make Payment,Accounts,Org Admin,Gives users access to view payment details and make payments,Billing,,,,,,,
50110,view_billing_details_50110,View Billing Details,Accounts,Org Admin,Gives users access to view billing details,Billing,,,,,,,
50880,purchase_more_minutes_50880,Purchase More Minutes,Accounts,Org Admin,Gives users access to purchase more minutes,Billing,,,,,,,
50881,purchase_more_storage_50881,Purchase More Storage,Accounts,Org Admin,Gives users access to purchase more storage,Billing,,,,,,,
50882,purchase_next_plan_50882,Purchase Next Plan,Accounts,Org Admin,Gives users access to purchase the next plan,Billing,,,,,,,
50883,download_billing_50883,Download Billing,Accounts,Org Admin,Gives users access to download billing,Billing,,,,,,,
60100,support_60100,Support,General,Student,Gives users access to Suppoort Page (i.e. via icons/buttons),Support,,,,,,,
60101,online_support_60101,Online Support,General,Student,Gives users access to view online support,Support,,,,,,,
70000,featured_programs_70000,Featured Programs,Library,Teacher,Gives users access to Featured Programs Page (i.e. via icons/buttons),Featured Programs,,,,,,,
70001,view_any_featured_programs_70001,View Any Featured Programs,Library,Teacher,Gives users access to view any featured programs,Featured Programs,,,,,,,
71000,view_bada_rhyme_71000,View Bada Rhyme,Library,Teacher,Gives users access to view Bada Rhyme,Featured Programs,,,,,,,
71001,view_bada_genius_71001,View Bada Genius,Library,Teacher,Gives users access to view Bada Genius,Featured Programs,,,,,,,
71002,view_bada_talk_71002,View Bada Talk,Library,Teacher,Gives users access to view Bada Talk,Featured Programs,,,,,,,
71003,view_bada_sound_71003,View Bada Sound,Library,Teacher,Gives users access to view Bada Sound,Featured Programs,,,,,,,
71004,view_bada_read_71004,View Bada Read,Library,Teacher,Gives users access to view Bada Read,Featured Programs,,,,,,,
71005,view_bada_math_71005,View Bada Math,Library,Teacher,Gives users access to view Bada Math,Featured Programs,,,,,,,
71006,view_bada_stem_71006,View Bada STEM,Library,Teacher,Gives users access to view Bada STEM,Featured Programs,,,,,,,
71007,view_badanamu_esl_71007,View Badanamu ESL,Library,Teacher,Gives users access to view Badanamu ESL,Featured Programs,,,,,,,
71008,undefined_71008,undefined,,,undefined,Featured Programs,,,,,,,
71009,undefined_71009,undefined,,,undefined,Featured Programs,,,,,,,
75000,create_bada_rhyme_75000,Create Bada Rhyme,Library,Super Admin,Gives users access to create Bada Rhyme,Featured Programs,,,,,,,
75001,create_bada_genius_75001,Create Bada Genius,Library,Super Admin,Gives users access to create Bada Genius,Featured Programs,,,,,,,
75002,create_bada_talk_75002,Create Bada Talk,Library,Super Admin,Gives users access to create Bada Talk,Featured Programs,,,,,,,
75003,create_bada_sound_75003,Create Bada Sound,Library,Super Admin,Gives users access to create Bada Sound,Featured Programs,,,,,,,
75004,create_bada_read_75004,Create Bada Read,Library,Super Admin,Gives users access to create Bada Read,Featured Programs,,,,,,,
75005,create_bada_math_75005,Create Bada Math,Library,Super Admin,Gives users access to create Bada Math,Featured Programs,,,,,,,
75006,create_bada_stem_75006,Create Bada STEM,Library,Super Admin,Gives users access to create Bada STEM,Featured Programs,,,,,,,
75007,create_badanamu_esl_75007,Create Badanamu ESL,Library,Super Admin,Gives users access to create Badanamu ESL ,Featured Programs,,,,,,,
75008,undefined_75008,undefined,,,undefined,Featured Programs,,,,,,,
75009,undefined_75009,undefined,,,undefined,Featured Programs,,,,,,,
78000,edit_bada_rhyme_78000,Edit Bada Rhyme,Library,Super Admin,Gives users access to edit Bada Rhyme,Featured Programs,,,,,,,
78001,edit_bada_genius_78001,Edit Bada Genius,Library,Super Admin,Gives users access to edit Bada Genius,Featured Programs,,,,,,,
78002,edit_bada_talk_78002,Edit Bada Talk,Library,Super Admin,Gives users access to edit Bada Talk,Featured Programs,,,,,,,
78003,edit_bada_sound_78003,Edit Bada Sound,Library,Super Admin,Gives users access to edit Bada Sound,Featured Programs,,,,,,,
78004,edit_bada_read_78004,Edit Bada Read,Library,Super Admin,Gives users access to edit Bada Read,Featured Programs,,,,,,,
78005,edit_bada_math_78005,Edit Bada Math,Library,Super Admin,Gives users access to edit Bada Math,Featured Programs,,,,,,,
78006,edit_bada_stem_78006,Edit Bada STEM,Library,Super Admin,Gives users access to edit Bada STEM,Featured Programs,,,,,,,
78007,edit_badanamu_esl_78007,Edit Badanamu ESL,Library,Super Admin,Gives users access to edit Badanamu ESL,Featured Programs,,,,,,,
78008,copy_featured_content_into_library_78008,Copy Featured Content into Library,Library,Org Admin,Gives user access to Copy Featured Content feature,Featured Programs,,,,,,,
78009,download_featured_content_78009,Download Featured Content,Library,Org Admin,Gives user access to Download Featured Content feture,Featured Programs,,,,,,,
